{
  "schemaVersion": "contract/v1",
  "capabilities": [
    { "id": "admin.governance", "commitment": "committed" },
    { "id": "agent.run", "commitment": "committed" },
    { "id": "agent.tool_execution", "commitment": "committed" },
    { "id": "billing.ledger_lifecycle", "commitment": "committed" },
    { "id": "billing.payment_lifecycle", "commitment": "committed" },
    { "id": "channel.delivery", "commitment": "committed" },
    { "id": "chat.conversation_use", "commitment": "committed" },
    { "id": "chat.export", "commitment": "committed" },
    { "id": "deployment.operations", "commitment": "committed" },
    { "id": "gateway.request_admission", "commitment": "committed" },
    { "id": "identity.account_session", "commitment": "committed" },
    { "id": "identity.organization_membership", "commitment": "committed" },
    { "id": "knowledge.ingestion", "commitment": "committed" },
    { "id": "knowledge.retrieval", "commitment": "committed" },
    { "id": "marketplace.commerce", "commitment": "committed" },
    { "id": "marketplace.governance", "commitment": "committed" },
    { "id": "mcp.custom_execution", "commitment": "conditional", "reasonCode": "dependency_unproven" },
    { "id": "mcp.network_execution", "commitment": "conditional", "reasonCode": "dependency_unproven" },
    { "id": "mcp.tool_execution", "commitment": "committed" },
    { "id": "observability.audit", "commitment": "committed" },
    { "id": "observability.slo", "commitment": "committed" },
    { "id": "relay.provider_inference", "commitment": "committed" },
    { "id": "relay.stream_cancel", "commitment": "committed" },
    { "id": "relay.usage_settlement", "commitment": "committed" },
    { "id": "release.contract_reporting", "commitment": "committed" },
    { "id": "sandbox.code_execution", "commitment": "excluded", "reasonCode": "capability_excluded" },
    { "id": "task.scheduled_execution", "commitment": "committed" },
    { "id": "workflow.graph_execution", "commitment": "committed" },
    { "id": "workflow.replay", "commitment": "committed" }
  ],
  "reasonCodes": [
    { "id": "build_identity_mismatch", "appliesTo": ["build", "report"], "description": "Build identity values do not match the trusted source identity." },
    { "id": "build_identity_missing", "appliesTo": ["build", "report"], "description": "A required trusted build identity is absent." },
    { "id": "capability_blocked", "appliesTo": ["capability", "readiness"], "description": "A committed capability is blocked by current readiness." },
    { "id": "capability_disabled", "appliesTo": ["capability", "readiness"], "description": "A capability is disabled by policy." },
    { "id": "capability_excluded", "appliesTo": ["capability"], "description": "The capability is intentionally outside the committed release contract." },
    { "id": "capability_unknown", "appliesTo": ["capability"], "description": "The capability identifier is not authored by the release contract." },
    { "id": "contract_digest_mismatch", "appliesTo": ["build", "contract", "report"], "description": "The canonical contract digest differs from the trusted identity." },
    { "id": "dependency_unproven", "appliesTo": ["capability", "readiness"], "description": "A required external dependency has not been proven for the active environment." },
    { "id": "migration_replay_unavailable", "appliesTo": ["readiness", "surface"], "description": "A required migration replay environment is unavailable." },
    { "id": "profile_excluded", "appliesTo": ["operation", "profile"], "description": "The explicitly requested deployment profile is excluded." },
    { "id": "profile_parity_unproven", "appliesTo": ["capability", "profile"], "description": "The deployment profile has not proven behavioral parity with monolith." },
    { "id": "profile_required", "appliesTo": ["operation", "profile"], "description": "A deployment profile must be explicitly selected." },
    { "id": "readiness_stale", "appliesTo": ["readiness"], "description": "The current readiness evaluation is older than its authored freshness bound." },
    { "id": "readiness_unavailable", "appliesTo": ["readiness"], "description": "No valid readiness evaluation is available." },
    { "id": "report_output_unwritable", "appliesTo": ["report"], "description": "A report could not be committed atomically to its destination." },
    { "id": "source_worktree_dirty", "appliesTo": ["build"], "description": "The source worktree is not clean and cannot produce trusted build identity." },
    { "id": "surface_drift", "appliesTo": ["surface"], "description": "A committed contract surface differs from its canonical source." },
    { "id": "surface_schema_invalid", "appliesTo": ["report", "surface"], "description": "A surface report does not conform to its registered schema." },
    { "id": "toolchain_mismatch", "appliesTo": ["build", "surface"], "description": "The observed generation toolchain differs from the pinned toolchain." }
  ],
  "defaultProfile": "monolith",
  "profiles": [
    {
      "id": "dual",
      "commitment": "excluded",
      "reasonCode": "profile_parity_unproven",
      "topology": { "kind": "dual", "components": ["gateway", "monolith", "services"] },
      "entrypoints": ["gateway", "server"],
      "dependencies": [
        { "id": "clickhouse", "required": true },
        { "id": "kafka", "required": true },
        { "id": "postgres", "required": true },
        { "id": "qdrant", "required": true },
        { "id": "redis", "required": true }
      ],
      "stateStores": [
        { "id": "analytics", "kind": "clickhouse" },
        { "id": "events", "kind": "kafka" },
        { "id": "primary", "kind": "postgres" },
        { "id": "queue", "kind": "redis" },
        { "id": "vectors", "kind": "qdrant" }
      ],
      "capabilityOverrides": [
        { "capabilityId": "deployment.operations", "commitment": "excluded", "reasonCode": "profile_parity_unproven" }
      ],
      "operations": {
        "migrate": { "profileId": "dual", "path": "scripts/release-profile-operation.sh", "argv": ["dual", "migrate"] },
        "deploy": { "profileId": "dual", "path": "scripts/release-profile-operation.sh", "argv": ["dual", "deploy"] },
        "rollback": { "profileId": "dual", "path": "scripts/release-profile-operation.sh", "argv": ["dual", "rollback"] }
      },
      "catalogBindingIds": ["model.gpt-3.5-turbo", "model.gpt-4-turbo", "model.gpt-4o", "model.gpt-4o-mini", "model.text-embedding-3-small", "runtime.custom", "runtime.mcp", "runtime.sandbox", "tool.calculator", "tool.datetime", "tool.http_request", "tool.json_formatter", "tool.text_transform", "tool.web_search"],
      "surfaceReferenceIds": ["build-identity", "catalog", "deployment", "frontend", "http", "migrations", "protobuf", "readiness"],
      "readinessRequirementIds": ["catalog-policy", "core-database", "provider-runtime", "request-logging", "retrieval", "sandbox-capacity", "scheduler"]
    },
    {
      "id": "microservices",
      "commitment": "excluded",
      "reasonCode": "profile_parity_unproven",
      "topology": { "kind": "microservices", "components": ["agent", "billing", "channel", "chat", "gateway", "marketplace", "observability", "rag", "relay", "task", "workflow"] },
      "entrypoints": ["agent", "billing", "channel", "chat", "gateway", "marketplace", "observability", "rag", "relay", "task", "workflow"],
      "dependencies": [
        { "id": "clickhouse", "required": true },
        { "id": "kafka", "required": true },
        { "id": "postgres", "required": true },
        { "id": "qdrant", "required": true },
        { "id": "redis", "required": true }
      ],
      "stateStores": [
        { "id": "analytics", "kind": "clickhouse" },
        { "id": "events", "kind": "kafka" },
        { "id": "primary", "kind": "postgres" },
        { "id": "queue", "kind": "redis" },
        { "id": "vectors", "kind": "qdrant" }
      ],
      "capabilityOverrides": [
        { "capabilityId": "deployment.operations", "commitment": "excluded", "reasonCode": "profile_parity_unproven" }
      ],
      "operations": {
        "migrate": { "profileId": "microservices", "path": "scripts/release-profile-operation.sh", "argv": ["microservices", "migrate"] },
        "deploy": { "profileId": "microservices", "path": "scripts/release-profile-operation.sh", "argv": ["microservices", "deploy"] },
        "rollback": { "profileId": "microservices", "path": "scripts/release-profile-operation.sh", "argv": ["microservices", "rollback"] }
      },
      "catalogBindingIds": ["model.gpt-3.5-turbo", "model.gpt-4-turbo", "model.gpt-4o", "model.gpt-4o-mini", "model.text-embedding-3-small", "runtime.custom", "runtime.mcp", "runtime.sandbox", "tool.calculator", "tool.datetime", "tool.http_request", "tool.json_formatter", "tool.text_transform", "tool.web_search"],
      "surfaceReferenceIds": ["build-identity", "catalog", "deployment", "frontend", "http", "migrations", "protobuf", "readiness"],
      "readinessRequirementIds": ["catalog-policy", "core-database", "provider-runtime", "request-logging", "retrieval", "sandbox-capacity", "scheduler"]
    },
    {
      "id": "monolith",
      "commitment": "committed",
      "topology": { "kind": "monolith", "components": ["server"] },
      "entrypoints": ["grpc-smoke", "migrate", "server"],
      "dependencies": [
        { "id": "clickhouse", "required": true },
        { "id": "kafka", "required": false },
        { "id": "postgres", "required": true },
        { "id": "qdrant", "required": true },
        { "id": "redis", "required": true }
      ],
      "stateStores": [
        { "id": "analytics", "kind": "clickhouse" },
        { "id": "events", "kind": "kafka" },
        { "id": "primary", "kind": "postgres" },
        { "id": "queue", "kind": "redis" },
        { "id": "vectors", "kind": "qdrant" }
      ],
      "capabilityOverrides": [],
      "operations": {